{
  "schemaVersion": 1,
  "id": "device.sony-a7-iii",
  "kind": "device",
  "name": "Sony A7 III",
  "description": "Sony ILCE-7M3 机身档案，E 卡口镜头池（24-70 GM / 50 1.8 / 85 1.8），Software 写的是机身固件串与后期软件。",
  "tags": ["相机", "Sony", "全画幅"],
  "source": "builtin",
  "author": "pict",
  "license": "CC0-1.0",
  "fields": {
    "EXIF:Make": { "mode": "fixed", "value": "SONY" },
    "EXIF:Model": { "mode": "fixed", "value": "ILCE-7M3" },
    "EXIF:Software": {
      "mode": "pool",
      "pool": [
        { "value": "ILCE-7M3 v4.01", "weight": 3 },
        { "value": "Adobe Photoshop Lightroom Classic 13.2 (Windows)", "weight": 2 },
        { "value": "Capture One 23 Pro", "weight": 1 }
      ]
    },
    "EXIF:LensMake": { "mode": "fixed", "value": "SONY" },
    "EXIF:LensModel": {
      "mode": "pool",
      "pool": [
        { "value": "FE 24-70mm F2.8 GM", "weight": 4 },
        { "value": "FE 50mm F1.8", "weight": 2 },
        { "value": "FE 85mm F1.8", "weight": 2 }
      ]
    },
    "EXIF:ExposureProgram": { "mode": "pool", "pool": [{ "value": 3, "weight": 3 }, { "value": 1, "weight": 2 }] },
    "EXIF:MeteringMode": { "mode": "fixed", "value": 5 },
    "EXIF:WhiteBalance": { "mode": "fixed", "value": 0 },
    "EXIF:ExposureMode": { "mode": "pool", "pool": [{ "value": 0, "weight": 3 }, { "value": 1, "weight": 1 }] },
    "EXIF:SceneCaptureType": { "mode": "fixed", "value": 0 },
    "EXIF:ColorSpace": { "mode": "fixed", "value": 1 },
    "EXIF:Contrast": { "mode": "fixed", "value": 0 },
    "EXIF:Saturation": { "mode": "fixed", "value": 0 },
    "EXIF:Sharpness": { "mode": "fixed", "value": 0 },
    "EXIF:FNumber": { "mode": "range", "min": 1.8, "max": 4.0, "precision": 1 },
    "EXIF:FocalLength": { "mode": "range", "min": 24, "max": 85, "precision": 0 },
    "EXIF:FocalLengthIn35mmFilm": { "mode": "range", "min": 24, "max": 85, "precision": 0 },
    "EXIF:ExposureTime": {
      "mode": "pool",
      "pool": [
        { "value": "1/125", "weight": 3 },
        { "value": "1/250", "weight": 3 },
        { "value": "1/500", "weight": 2 },
        { "value": "1/60", "weight": 2 },
        { "value": "1/1000", "weight": 1 }
      ]
    },
    "EXIF:ISOSpeedRatings": {
      "mode": "pool",
      "pool": [
        { "value": 100, "weight": 4 },
        { "value": 200, "weight": 3 },
        { "value": 400, "weight": 2 },
        { "value": 800, "weight": 2 },
        { "value": 1600, "weight": 1 }
      ]
    },
    "EXIF:ExposureBiasValue": {
      "mode": "pool",
      "pool": [
        { "value": "0/1", "weight": 4 },
        { "value": "-1/3", "weight": 2 },
        { "value": "1/3", "weight": 2 }
      ]
    },
    "EXIF:Flash": { "mode": "fixed", "value": 16 },
    "EXIF:BodySerialNumber": { "mode": "fromSource", "sourceKey": "EXIF:BodySerialNumber" },
    "XMP:xmp:CreatorTool": { "mode": "fixed", "value": "Adobe Photoshop Lightroom Classic 13.2" },
    "XMP:tiff:Make": { "mode": "fixed", "value": "SONY" },
    "XMP:tiff:Model": { "mode": "fixed", "value": "ILCE-7M3" }
  },
  "constraints": [
    { "type": "requires", "fields": ["EXIF:Make", "EXIF:Model"] },
    { "type": "clamp", "fields": ["EXIF:FNumber", "EXIF:FocalLength", "EXIF:ISOSpeedRatings"] }
  ]
}
