{
  "schemaVersion": 1,
  "id": "device.iphone-15-pro",
  "kind": "device",
  "name": "iPhone 15 Pro",
  "description": "iPhone 15 Pro / Pro Max 档案，镜头串按 Apple 惯例写（back triple camera 6.765mm f/1.78 一类），系统版本池停在 iOS 17 线。",
  "tags": ["手机", "Apple", "iOS"],
  "source": "builtin",
  "author": "pict",
  "license": "CC0-1.0",
  "fields": {
    "EXIF:Make": { "mode": "fixed", "value": "Apple" },
    "EXIF:Model": {
      "mode": "pool",
      "pool": [
        { "value": "iPhone 15 Pro", "weight": 3 },
        { "value": "iPhone 15 Pro Max", "weight": 1 }
      ]
    },
    "EXIF:Software": {
      "mode": "pool",
      "pool": [
        { "value": "17.5.1", "weight": 3 },
        { "value": "17.4.1", "weight": 2 },
        { "value": "17.2.1", "weight": 2 },
        { "value": "17.1.2", "weight": 1 }
      ]
    },
    "EXIF:LensMake": { "mode": "fixed", "value": "Apple" },
    "EXIF:LensModel": {
      "mode": "pool",
      "pool": [
        { "value": "iPhone 15 Pro back triple camera 6.765mm f/1.78", "weight": 6 },
        { "value": "iPhone 15 Pro back triple camera 2.22mm f/2.2", "weight": 2 },
        { "value": "iPhone 15 Pro back triple camera 15.66mm f/2.8", "weight": 2 },
        { "value": "iPhone 15 Pro front camera 2.69mm f/1.9", "weight": 1 }
      ]
    },
    "EXIF:ExposureProgram": { "mode": "fixed", "value": 2 },
    "EXIF:MeteringMode": { "mode": "fixed", "value": 5 },
    "EXIF:WhiteBalance": { "mode": "fixed", "value": 0 },
    "EXIF:ExposureMode": { "mode": "fixed", "value": 0 },
    "EXIF:SceneCaptureType": { "mode": "fixed", "value": 0 },
    "EXIF:ColorSpace": { "mode": "fixed", "value": 1 },
    "EXIF:FNumber": { "mode": "range", "min": 1.78, "max": 2.8, "precision": 2 },
    "EXIF:FocalLength": { "mode": "range", "min": 2.22, "max": 15.66, "precision": 2 },
    "EXIF:FocalLengthIn35mmFilm": {
      "mode": "pool",
      "pool": [
        { "value": 24, "weight": 6 },
        { "value": 13, "weight": 2 },
        { "value": 77, "weight": 2 },
        { "value": 23, "weight": 1 }
      ]
    },
    "EXIF:ExposureTime": {
      "mode": "pool",
      "pool": [
        { "value": "1/120", "weight": 4 },
        { "value": "1/60", "weight": 3 },
        { "value": "1/250", "weight": 2 },
        { "value": "1/500", "weight": 1 }
      ]
    },
    "EXIF:ISOSpeedRatings": {
      "mode": "pool",
      "pool": [
        { "value": 32, "weight": 2 },
        { "value": 50, "weight": 3 },
        { "value": 64, "weight": 3 },
        { "value": 100, "weight": 2 },
        { "value": 200, "weight": 1 }
      ]
    },
    "EXIF:ExposureBiasValue": { "mode": "fixed", "value": "0/1" },
    "EXIF:Flash": { "mode": "fixed", "value": 16 },
    "XMP:photoshop:DateCreated": {
      "mode": "datetime",
      "start": "2025-01-01T00:00:00",
      "end": "2025-12-31T23:59:59",
      "hourWeights": [0,0,0,0,0,1,2,4,6,8,9,9,8,8,8,7,6,5,4,3,2,1,0,0]
    },
    "XMP:tiff:Make": { "mode": "fixed", "value": "Apple" },
    "XMP:tiff:Model": { "mode": "fixed", "value": "iPhone 15 Pro" }
  },
  "constraints": [
    { "type": "requires", "fields": ["EXIF:Make", "EXIF:Model"] },
    { "type": "clamp", "fields": ["EXIF:FNumber", "EXIF:FocalLength", "EXIF:ISOSpeedRatings"] }
  ]
}
