{
  "schemaVersion": 1,
  "id": "device.canon-eos-5d-mark-iv",
  "kind": "device",
  "name": "Canon EOS 5D Mark IV",
  "description": "佳能 5D4 单反档案，EF 卡口镜头池（24-70 二代 / 50 小痰盂 / 70-200 三代），带机身序列号原样透传。",
  "tags": ["相机", "Canon", "全画幅", "单反"],
  "source": "builtin",
  "author": "pict",
  "license": "CC0-1.0",
  "fields": {
    "EXIF:Make": { "mode": "fixed", "value": "Canon" },
    "EXIF:Model": { "mode": "fixed", "value": "Canon EOS 5D Mark IV" },
    "EXIF:Software": {
      "mode": "pool",
      "pool": [
        { "value": "Adobe Photoshop Lightroom Classic 13.2 (Windows)", "weight": 3 },
        { "value": "Digital Photo Professional 4.18", "weight": 2 }
      ]
    },
    "EXIF:LensMake": { "mode": "fixed", "value": "Canon" },
    "EXIF:LensModel": {
      "mode": "pool",
      "pool": [
        { "value": "EF24-70mm f/2.8L II USM", "weight": 4 },
        { "value": "EF50mm f/1.8 STM", "weight": 2 },
        { "value": "EF70-200mm f/2.8L IS III USM", "weight": 2 }
      ]
    },
    "EXIF:ExposureProgram": { "mode": "pool", "pool": [{ "value": 3, "weight": 3 }, { "value": 1, "weight": 2 }, { "value": 2, "weight": 1 }] },
    "EXIF:MeteringMode": { "mode": "fixed", "value": 5 },
    "EXIF:WhiteBalance": { "mode": "pool", "pool": [{ "value": 0, "weight": 3 }, { "value": 1, "weight": 1 }] },
    "EXIF:ExposureMode": { "mode": "pool", "pool": [{ "value": 0, "weight": 3 }, { "value": 1, "weight": 1 }] },
    "EXIF:SceneCaptureType": { "mode": "fixed", "value": 0 },
    "EXIF:ColorSpace": { "mode": "fixed", "value": 1 },
    "EXIF:Contrast": { "mode": "fixed", "value": 0 },
    "EXIF:Saturation": { "mode": "fixed", "value": 0 },
    "EXIF:Sharpness": { "mode": "fixed", "value": 0 },
    "EXIF:FNumber": { "mode": "range", "min": 1.8, "max": 8.0, "precision": 1 },
    "EXIF:FocalLength": { "mode": "range", "min": 24, "max": 200, "precision": 0 },
    "EXIF:FocalLengthIn35mmFilm": { "mode": "range", "min": 24, "max": 200, "precision": 0 },
    "EXIF:ExposureTime": {
      "mode": "pool",
      "pool": [
        { "value": "1/125", "weight": 3 },
        { "value": "1/250", "weight": 3 },
        { "value": "1/500", "weight": 2 },
        { "value": "1/60", "weight": 2 },
        { "value": "1/1000", "weight": 1 }
      ]
    },
    "EXIF:ISOSpeedRatings": {
      "mode": "pool",
      "pool": [
        { "value": 100, "weight": 4 },
        { "value": 200, "weight": 3 },
        { "value": 400, "weight": 2 },
        { "value": 800, "weight": 2 },
        { "value": 1600, "weight": 1 }
      ]
    },
    "EXIF:ExposureBiasValue": {
      "mode": "pool",
      "pool": [
        { "value": "0/1", "weight": 4 },
        { "value": "-1/3", "weight": 2 },
        { "value": "1/3", "weight": 2 }
      ]
    },
    "EXIF:Flash": { "mode": "fixed", "value": 16 },
    "EXIF:BodySerialNumber": { "mode": "fromSource", "sourceKey": "EXIF:BodySerialNumber" },
    "XMP:xmp:CreatorTool": { "mode": "fixed", "value": "Adobe Photoshop Lightroom Classic 13.2" },
    "XMP:tiff:Make": { "mode": "fixed", "value": "Canon" },
    "XMP:tiff:Model": { "mode": "fixed", "value": "Canon EOS 5D Mark IV" }
  },
  "constraints": [
    { "type": "requires", "fields": ["EXIF:Make", "EXIF:Model"] },
    { "type": "clamp", "fields": ["EXIF:FNumber", "EXIF:FocalLength", "EXIF:ISOSpeedRatings"] }
  ]
}
