{
  "schemaVersion": 1,
  "id": "device.canon-r6m2",
  "kind": "device",
  "name": "Canon EOS R6 Mark II",
  "description": "佳能 EOS R6 Mark II：EXIF 机型串是 Canon EOS R6m2。镜头池为 RF 卡口常见镜头，光圈焦距按区间抽取，机身固件串按 Canon 的「Firmware Version x.y.z」记法。",
  "tags": [
    "相机",
    "Canon",
    "全画幅"
  ],
  "source": "builtin",
  "author": "pict",
  "license": "CC0-1.0",
  "fields": {
    "EXIF:Make": {
      "mode": "fixed",
      "value": "Canon"
    },
    "EXIF:Model": {
      "mode": "fixed",
      "value": "Canon EOS R6m2"
    },
    "EXIF:Software": {
      "mode": "pool",
      "pool": [
        {
          "value": "Adobe Lightroom Classic 13.3 (Windows)",
          "weight": 2
        },
        {
          "value": "Adobe Photoshop 25.6 (Windows)",
          "weight": 1
        },
        {
          "value": "Firmware Version 1.1.0",
          "weight": 1,
          "note": "机身固件"
        }
      ]
    },
    "EXIF:LensMake": {
      "mode": "fixed",
      "value": "Canon"
    },
    "EXIF:LensModel": {
      "mode": "pool",
      "pool": [
        {
          "value": "RF24-105mm F4 L IS USM",
          "weight": 4
        },
        {
          "value": "RF50mm F1.8 STM",
          "weight": 2
        },
        {
          "value": "RF70-200mm F2.8 L IS USM",
          "weight": 2
        },
        {
          "value": "RF15-35mm F2.8 L IS USM",
          "weight": 1
        }
      ]
    },
    "EXIF:ExposureProgram": {
      "mode": "pool",
      "pool": [
        {
          "value": 3,
          "weight": 3,
          "note": "光圈优先"
        },
        {
          "value": 1,
          "weight": 2,
          "note": "手动"
        }
      ]
    },
    "EXIF:MeteringMode": {
      "mode": "fixed",
      "value": 5
    },
    "EXIF:WhiteBalance": {
      "mode": "fixed",
      "value": 0
    },
    "EXIF:ExposureMode": {
      "mode": "pool",
      "pool": [
        {
          "value": 0,
          "weight": 3
        },
        {
          "value": 1,
          "weight": 1
        }
      ]
    },
    "EXIF:SceneCaptureType": {
      "mode": "fixed",
      "value": 0
    },
    "EXIF:ColorSpace": {
      "mode": "fixed",
      "value": 1
    },
    "EXIF:Contrast": {
      "mode": "fixed",
      "value": 0
    },
    "EXIF:Saturation": {
      "mode": "fixed",
      "value": 0
    },
    "EXIF:Sharpness": {
      "mode": "fixed",
      "value": 0
    },
    "EXIF:FNumber": {
      "mode": "range",
      "min": 1.8,
      "max": 11.0,
      "precision": 1
    },
    "EXIF:FocalLength": {
      "mode": "range",
      "min": 15,
      "max": 200,
      "precision": 0
    },
    "EXIF:FocalLengthIn35mmFilm": {
      "mode": "range",
      "min": 15,
      "max": 200,
      "precision": 0
    },
    "EXIF:ExposureTime": {
      "mode": "pool",
      "pool": [
        {
          "value": "1/60",
          "weight": 2
        },
        {
          "value": "1/120",
          "weight": 3
        },
        {
          "value": "1/250",
          "weight": 3
        },
        {
          "value": "1/500",
          "weight": 2
        },
        {
          "value": "1/1000",
          "weight": 1
        }
      ]
    },
    "EXIF:ISOSpeedRatings": {
      "mode": "pool",
      "pool": [
        {
          "value": 100,
          "weight": 4
        },
        {
          "value": 200,
          "weight": 3
        },
        {
          "value": 400,
          "weight": 2
        },
        {
          "value": 800,
          "weight": 1
        },
        {
          "value": 1600,
          "weight": 1
        }
      ]
    },
    "EXIF:ExposureBiasValue": {
      "mode": "pool",
      "pool": [
        {
          "value": "0/1",
          "weight": 4
        },
        {
          "value": "-1/3",
          "weight": 2
        },
        {
          "value": "1/3",
          "weight": 2
        }
      ]
    },
    "EXIF:Flash": {
      "mode": "fixed",
      "value": 16
    },
    "XMP:xmp:CreatorTool": {
      "mode": "pool",
      "pool": [
        {
          "value": "Adobe Lightroom Classic 13.3",
          "weight": 1
        }
      ]
    },
    "XMP:tiff:Make": {
      "mode": "fixed",
      "value": "Canon"
    },
    "XMP:tiff:Model": {
      "mode": "fixed",
      "value": "Canon EOS R6m2"
    }
  },
  "constraints": [
    {
      "type": "requires",
      "fields": [
        "EXIF:Make",
        "EXIF:Model"
      ]
    },
    {
      "type": "clamp",
      "fields": [
        "EXIF:FNumber",
        "EXIF:FocalLength",
        "EXIF:ISOSpeedRatings"
      ]
    }
  ]
}
