{
  "schemaVersion": 1,
  "id": "device.dji-mini4pro",
  "kind": "device",
  "name": "DJI Mini 4 Pro",
  "description": "DJI Mini 4 Pro：相机串 FC8482，广角 f/1.7、6.72 mm（24 mm 等效）。经纬度交给位置预设，这里不含 GPS 坐标。",
  "tags": [
    "无人机",
    "DJI"
  ],
  "source": "builtin",
  "author": "pict",
  "license": "CC0-1.0",
  "fields": {
    "EXIF:Make": {
      "mode": "fixed",
      "value": "DJI"
    },
    "EXIF:Model": {
      "mode": "fixed",
      "value": "FC8482"
    },
    "EXIF:Software": {
      "mode": "fixed",
      "value": "10.08.04.08"
    },
    "EXIF:FNumber": {
      "mode": "fixed",
      "value": 1.7
    },
    "EXIF:FocalLength": {
      "mode": "fixed",
      "value": 6.72
    },
    "EXIF:FocalLengthIn35mmFilm": {
      "mode": "fixed",
      "value": 24
    },
    "EXIF:ExposureProgram": {
      "mode": "fixed",
      "value": 2
    },
    "EXIF:MeteringMode": {
      "mode": "fixed",
      "value": 1
    },
    "EXIF:LightSource": {
      "mode": "pool",
      "pool": [
        {
          "value": 1,
          "weight": 3,
          "note": "日光"
        },
        {
          "value": 0,
          "weight": 1,
          "note": "自动/未知"
        }
      ]
    },
    "EXIF:WhiteBalance": {
      "mode": "fixed",
      "value": 0
    },
    "EXIF:ExposureMode": {
      "mode": "fixed",
      "value": 0
    },
    "EXIF:SceneCaptureType": {
      "mode": "fixed",
      "value": 0
    },
    "EXIF:ColorSpace": {
      "mode": "fixed",
      "value": 1
    },
    "EXIF:Contrast": {
      "mode": "fixed",
      "value": 0
    },
    "EXIF:Saturation": {
      "mode": "fixed",
      "value": 0
    },
    "EXIF:Sharpness": {
      "mode": "fixed",
      "value": 0
    },
    "EXIF:GainControl": {
      "mode": "fixed",
      "value": 0
    },
    "EXIF:SubjectDistance": {
      "mode": "fixed",
      "value": 0
    },
    "EXIF:ExposureTime": {
      "mode": "pool",
      "pool": [
        {
          "value": "1/250",
          "weight": 1
        },
        {
          "value": "1/500",
          "weight": 2
        },
        {
          "value": "1/1000",
          "weight": 2
        },
        {
          "value": "1/2500",
          "weight": 2
        }
      ]
    },
    "EXIF:ISOSpeedRatings": {
      "mode": "pool",
      "pool": [
        {
          "value": 100,
          "weight": 3
        },
        {
          "value": 200,
          "weight": 2
        },
        {
          "value": 400,
          "weight": 1
        }
      ]
    },
    "EXIF:ExposureBiasValue": {
      "mode": "pool",
      "pool": [
        {
          "value": "0/1",
          "weight": 3
        },
        {
          "value": "-1/3",
          "weight": 1
        },
        {
          "value": "-2/3",
          "weight": 1
        }
      ]
    },
    "EXIF:Flash": {
      "mode": "fixed",
      "value": 16
    },
    "XMP:tiff:Make": {
      "mode": "fixed",
      "value": "DJI"
    },
    "XMP:tiff:Model": {
      "mode": "fixed",
      "value": "FC8482"
    }
  },
  "constraints": [
    {
      "type": "requires",
      "fields": [
        "EXIF:Make",
        "EXIF:Model"
      ]
    },
    {
      "type": "clamp",
      "fields": [
        "EXIF:FNumber",
        "EXIF:FocalLength",
        "EXIF:ISOSpeedRatings"
      ]
    }
  ]
}
