{
  "schemaVersion": 1,
  "id": "device.nikon-z50",
  "kind": "device",
  "name": "Nikon Z 50",
  "description": "尼康 Z 50 半画幅微单档案，Z DX 镜头池（16-50 套头 / 50-250 长焦）。尼康机身 EXIF:Make 是全大写的 NIKON CORPORATION，机型写作 NIKON Z 50。",
  "tags": ["相机", "Nikon", "APS-C"],
  "source": "builtin",
  "author": "pict",
  "license": "CC0-1.0",
  "fields": {
    "EXIF:Make": { "mode": "fixed", "value": "NIKON CORPORATION" },
    "EXIF:Model": { "mode": "fixed", "value": "NIKON Z 50" },
    "EXIF:Software": {
      "mode": "pool",
      "pool": [
        { "value": "Adobe Photoshop Lightroom Classic 13.2 (Windows)", "weight": 3 },
        { "value": "Capture One 23 Pro", "weight": 2 }
      ]
    },
    "EXIF:LensModel": {
      "mode": "pool",
      "pool": [
        { "value": "NIKKOR Z DX 16-50mm f/3.5-6.3 VR", "weight": 4 },
        { "value": "NIKKOR Z DX 50-250mm f/4.5-6.3 VR", "weight": 2 }
      ]
    },
    "EXIF:ExposureProgram": { "mode": "pool", "pool": [{ "value": 2, "weight": 3 }, { "value": 3, "weight": 2 }] },
    "EXIF:MeteringMode": { "mode": "fixed", "value": 5 },
    "EXIF:WhiteBalance": { "mode": "fixed", "value": 0 },
    "EXIF:ExposureMode": { "mode": "fixed", "value": 0 },
    "EXIF:SceneCaptureType": { "mode": "fixed", "value": 0 },
    "EXIF:ColorSpace": { "mode": "fixed", "value": 1 },
    "EXIF:Contrast": { "mode": "fixed", "value": 0 },
    "EXIF:Saturation": { "mode": "fixed", "value": 0 },
    "EXIF:Sharpness": { "mode": "fixed", "value": 0 },
    "EXIF:FNumber": {
      "mode": "pool",
      "pool": [
        { "value": 3.5, "weight": 3 },
        { "value": 4.5, "weight": 2 },
        { "value": 5.6, "weight": 2 },
        { "value": 6.3, "weight": 3 }
      ]
    },
    "EXIF:FocalLength": { "mode": "range", "min": 16, "max": 250, "precision": 0 },
    "EXIF:FocalLengthIn35mmFilm": { "mode": "range", "min": 24, "max": 375, "precision": 0 },
    "EXIF:ExposureTime": {
      "mode": "pool",
      "pool": [
        { "value": "1/125", "weight": 3 },
        { "value": "1/250", "weight": 3 },
        { "value": "1/500", "weight": 2 },
        { "value": "1/60", "weight": 2 }
      ]
    },
    "EXIF:ISOSpeedRatings": {
      "mode": "pool",
      "pool": [
        { "value": 100, "weight": 4 },
        { "value": 200, "weight": 3 },
        { "value": 400, "weight": 2 },
        { "value": 800, "weight": 2 },
        { "value": 1600, "weight": 1 }
      ]
    },
    "EXIF:ExposureBiasValue": {
      "mode": "pool",
      "pool": [
        { "value": "0/1", "weight": 4 },
        { "value": "-1/3", "weight": 2 },
        { "value": "1/3", "weight": 2 }
      ]
    },
    "EXIF:Flash": { "mode": "fixed", "value": 16 },
    "EXIF:BodySerialNumber": { "mode": "fromSource", "sourceKey": "EXIF:BodySerialNumber" },
    "XMP:xmp:CreatorTool": { "mode": "fixed", "value": "Adobe Photoshop Lightroom Classic 13.2" },
    "XMP:tiff:Make": { "mode": "fixed", "value": "NIKON CORPORATION" },
    "XMP:tiff:Model": { "mode": "fixed", "value": "NIKON Z 50" }
  },
  "constraints": [
    { "type": "requires", "fields": ["EXIF:Make", "EXIF:Model"] },
    { "type": "clamp", "fields": ["EXIF:FNumber", "EXIF:FocalLength", "EXIF:ISOSpeedRatings"] }
  ]
}
