{
  "schemaVersion": 1,
  "id": "device.iphone-14-pro",
  "kind": "device",
  "name": "iPhone 14 Pro",
  "description": "Apple iPhone 14 Pro / Pro Max，三摄。镜头串取自真机 EXIF：6.86mm f/1.78 主摄（24mm 等效）、2.22mm f/2.2 超广角（13mm 等效）、9mm f/2.8 长焦（77mm 等效）、前置 2.69mm f/1.9。Pro 与 Pro Max 四种镜头串（主摄/超广角/长焦/前置）均已查到实拍 EXIF，共 8 串全列。前置 35mm 等效池含真机常报的 30mm。系统版本池 16.0 首发至 26.7。",
  "tags": ["手机", "Apple", "iOS"],
  "source": "builtin",
  "author": "pict",
  "license": "CC0-1.0",
  "fields": {
    "EXIF:Make": { "mode": "fixed", "value": "Apple" },
    "EXIF:Model": {
      "mode": "pool",
      "pool": [
        { "value": "iPhone 14 Pro", "weight": 3 },
        { "value": "iPhone 14 Pro Max", "weight": 1 }
      ]
    },
    "EXIF:Software": {
      "mode": "pool",
      "pool": [
        { "value": "16.0", "weight": 1, "note": "首发系统" },
        { "value": "16.7.2", "weight": 1, "note": "iOS 16 线末期" },
        { "value": "17.7.2", "weight": 1, "note": "iOS 17 线末期" },
        { "value": "18.7.10", "weight": 3, "note": "iOS 18 线末期" },
        { "value": "26.7", "weight": 2 }
      ]
    },
    "EXIF:LensMake": { "mode": "fixed", "value": "Apple" },
    "EXIF:LensModel": {
      "mode": "pool",
      "pool": [
        { "value": "iPhone 14 Pro back triple camera 6.86mm f/1.78", "weight": 6, "note": "48MP 主摄，24mm 等效" },
        { "value": "iPhone 14 Pro back triple camera 2.22mm f/2.2", "weight": 3, "note": "超广角，13mm 等效" },
        { "value": "iPhone 14 Pro back triple camera 9mm f/2.8", "weight": 2, "note": "长焦，77mm 等效" },
        { "value": "iPhone 14 Pro front camera 2.69mm f/1.9", "weight": 2, "note": "前置 TrueDepth，自动对焦" },
        { "value": "iPhone 14 Pro Max back triple camera 6.86mm f/1.78", "weight": 2, "note": "Pro Max 主摄，24mm 等效" },
        { "value": "iPhone 14 Pro Max back triple camera 2.22mm f/2.2", "weight": 1, "note": "Pro Max 超广角" },
        { "value": "iPhone 14 Pro Max back triple camera 9mm f/2.8", "weight": 1, "note": "Pro Max 长焦，3x" },
        { "value": "iPhone 14 Pro Max front camera 2.69mm f/1.9", "weight": 1, "note": "Pro Max 前置" }
      ]
    },
    "EXIF:ExposureProgram": { "mode": "fixed", "value": 2 },
    "EXIF:MeteringMode": { "mode": "fixed", "value": 5 },
    "EXIF:WhiteBalance": { "mode": "fixed", "value": 0 },
    "EXIF:ExposureMode": { "mode": "fixed", "value": 0 },
    "EXIF:SceneCaptureType": { "mode": "fixed", "value": 0 },
    "EXIF:ColorSpace": { "mode": "fixed", "value": 1 },
    "EXIF:FNumber": {
      "mode": "pool",
      "pool": [
        { "value": 1.78, "weight": 8, "note": "主摄" },
        { "value": 2.2, "weight": 4, "note": "超广角" },
        { "value": 2.8, "weight": 3, "note": "长焦" },
        { "value": 1.9, "weight": 3, "note": "前置" }
      ]
    },
    "EXIF:FocalLength": {
      "mode": "pool",
      "pool": [
        { "value": 6.86, "weight": 8, "note": "主摄" },
        { "value": 2.22, "weight": 4, "note": "超广角" },
        { "value": 9, "weight": 3, "note": "长焦" },
        { "value": 2.69, "weight": 3, "note": "前置" }
      ]
    },
    "EXIF:FocalLengthIn35mmFilm": {
      "mode": "pool",
      "pool": [
        { "value": 24, "weight": 8, "note": "主摄" },
        { "value": 13, "weight": 3, "note": "超广角" },
        { "value": 77, "weight": 2, "note": "长焦" },
        { "value": 23, "weight": 2, "note": "前置（官方 23mm）" },
        { "value": 30, "weight": 1, "note": "前置真机 EXIF 报值" }
      ]
    },
    "EXIF:ExposureTime": {
      "mode": "pool",
      "pool": [
        { "value": "1/60", "weight": 2 },
        { "value": "1/120", "weight": 3 },
        { "value": "1/250", "weight": 3 },
        { "value": "1/500", "weight": 2 },
        { "value": "1/1000", "weight": 1 },
        { "value": "1/2000", "weight": 1 }
      ]
    },
    "EXIF:ISOSpeedRatings": {
      "mode": "pool",
      "pool": [
        { "value": 25, "weight": 1, "note": "前置真机值" },
        { "value": 32, "weight": 3 },
        { "value": 50, "weight": 3 },
        { "value": 80, "weight": 3 },
        { "value": 100, "weight": 2 },
        { "value": 250, "weight": 1 },
        { "value": 640, "weight": 1 }
      ]
    },
    "EXIF:ExposureBiasValue": {
      "mode": "pool",
      "pool": [
        { "value": "0/1", "weight": 4 },
        { "value": "-1/3", "weight": 2 },
        { "value": "1/3", "weight": 2 }
      ]
    },
    "EXIF:Flash": { "mode": "fixed", "value": 16 },
    "EXIF:SubSecTimeOriginal": {
      "mode": "pool",
      "pool": [
        { "value": "123", "weight": 2 },
        { "value": "456", "weight": 2 },
        { "value": "789", "weight": 1 }
      ]
    },
    "EXIF:SubSecTimeDigitized": {
      "mode": "pool",
      "pool": [
        { "value": "123", "weight": 2 },
        { "value": "456", "weight": 2 },
        { "value": "789", "weight": 1 }
      ]
    },
    "XMP:xmp:CreatorTool": {
      "mode": "pool",
      "pool": [
        { "value": "17.7.2", "weight": 1 },
        { "value": "18.7.10", "weight": 3 },
        { "value": "26.7", "weight": 2 }
      ]
    },
    "XMP:tiff:Make": { "mode": "fixed", "value": "Apple" },
    "XMP:tiff:Model": {
      "mode": "pool",
      "pool": [
        { "value": "iPhone 14 Pro", "weight": 3 },
        { "value": "iPhone 14 Pro Max", "weight": 1 }
      ]
    }
  },
  "constraints": [
    { "type": "requires", "fields": ["EXIF:Make", "EXIF:Model"] },
    { "type": "clamp", "fields": ["EXIF:FNumber", "EXIF:FocalLength", "EXIF:ISOSpeedRatings"] }
  ]
}
