{
  "schemaVersion": 1,
  "id": "device.galaxy-s24-ultra",
  "kind": "device",
  "name": "Galaxy S24 Ultra",
  "description": "三星 Galaxy S24 Ultra。EXIF 机型串是区域型号（SM-S928B 等）而不是营销名，系统版本串是三星固件号；三星不写镜头型号串，所以这里没有 LensModel。",
  "tags": [
    "手机",
    "三星",
    "Android"
  ],
  "source": "builtin",
  "author": "pict",
  "license": "CC0-1.0",
  "fields": {
    "EXIF:Make": {
      "mode": "fixed",
      "value": "samsung"
    },
    "EXIF:Model": {
      "mode": "pool",
      "pool": [
        {
          "value": "SM-S928B",
          "weight": 4,
          "note": "国际版"
        },
        {
          "value": "SM-S928B/DS",
          "weight": 1,
          "note": "国际双卡"
        },
        {
          "value": "SM-S928N",
          "weight": 1,
          "note": "韩版"
        },
        {
          "value": "SM-S928U",
          "weight": 1,
          "note": "美版"
        }
      ]
    },
    "EXIF:Software": {
      "mode": "pool",
      "pool": [
        {
          "value": "S928BXXS6DZG1",
          "weight": 2,
          "note": "Android 16"
        },
        {
          "value": "S928BXXU5DZDP",
          "weight": 2,
          "note": "One UI 8.5"
        }
      ]
    },
    "EXIF:ExposureProgram": {
      "mode": "fixed",
      "value": 2
    },
    "EXIF:MeteringMode": {
      "mode": "fixed",
      "value": 5
    },
    "EXIF:WhiteBalance": {
      "mode": "fixed",
      "value": 0
    },
    "EXIF:ExposureMode": {
      "mode": "fixed",
      "value": 0
    },
    "EXIF:SceneCaptureType": {
      "mode": "fixed",
      "value": 0
    },
    "EXIF:ColorSpace": {
      "mode": "fixed",
      "value": 1
    },
    "EXIF:FNumber": {
      "mode": "pool",
      "pool": [
        {
          "value": 1.7,
          "weight": 6,
          "note": "主摄"
        },
        {
          "value": 2.2,
          "weight": 1,
          "note": "超广角/前置"
        },
        {
          "value": 2.4,
          "weight": 1,
          "note": "3 倍长焦"
        },
        {
          "value": 3.4,
          "weight": 1,
          "note": "5 倍长焦"
        }
      ]
    },
    "EXIF:ExposureTime": {
      "mode": "pool",
      "pool": [
        {
          "value": "1/60",
          "weight": 2
        },
        {
          "value": "1/120",
          "weight": 3
        },
        {
          "value": "1/250",
          "weight": 3
        },
        {
          "value": "1/500",
          "weight": 2
        },
        {
          "value": "1/1000",
          "weight": 1
        }
      ]
    },
    "EXIF:ISOSpeedRatings": {
      "mode": "pool",
      "pool": [
        {
          "value": 50,
          "weight": 4
        },
        {
          "value": 100,
          "weight": 3
        },
        {
          "value": 200,
          "weight": 2
        },
        {
          "value": 400,
          "weight": 1
        },
        {
          "value": 800,
          "weight": 1
        }
      ]
    },
    "EXIF:ExposureBiasValue": {
      "mode": "pool",
      "pool": [
        {
          "value": "0/1",
          "weight": 4
        },
        {
          "value": "-1/3",
          "weight": 1
        },
        {
          "value": "1/3",
          "weight": 1
        }
      ]
    },
    "EXIF:Flash": {
      "mode": "fixed",
      "value": 16
    },
    "XMP:tiff:Make": {
      "mode": "fixed",
      "value": "samsung"
    },
    "XMP:tiff:Model": {
      "mode": "fixed",
      "value": "SM-S928B"
    }
  },
  "constraints": [
    {
      "type": "requires",
      "fields": [
        "EXIF:Make",
        "EXIF:Model"
      ]
    },
    {
      "type": "clamp",
      "fields": [
        "EXIF:FNumber",
        "EXIF:FocalLength",
        "EXIF:ISOSpeedRatings"
      ]
    }
  ]
}
