{
  "schemaVersion": 1,
  "id": "device.pixel-9-pro",
  "kind": "device",
  "name": "Google Pixel 9 Pro",
  "description": "Google Pixel 9 Pro 拍摄档案，含主摄与长焦镜头池。",
  "tags": ["手机", "Google", "Android"],
  "source": "builtin",
  "author": "pict",
  "license": "CC0-1.0",
  "fields": {
    "EXIF:Make": { "mode": "fixed", "value": "Google" },
    "EXIF:Model": { "mode": "fixed", "value": "Pixel 9 Pro" },
    "EXIF:Software": {
      "mode": "pool",
      "pool": [
        { "value": "AP2A.240905.003", "weight": 3 },
        { "value": "AP4A.241205.013", "weight": 2 }
      ]
    },
    "EXIF:LensModel": {
      "mode": "pool",
      "pool": [
        { "value": "Pixel 9 Pro back camera 6.9mm f/1.68", "weight": 5 },
        { "value": "Pixel 9 Pro back camera 18.0mm f/2.8", "weight": 2, "note": "长焦" },
        { "value": "Pixel 9 Pro back camera 2.0mm f/2.2", "weight": 2, "note": "超广角" },
        { "value": "Pixel 9 Pro front camera 3.2mm f/2.2", "weight": 1 }
      ]
    },
    "EXIF:ExposureProgram": { "mode": "fixed", "value": 2 },
    "EXIF:MeteringMode": { "mode": "fixed", "value": 2 },
    "EXIF:WhiteBalance": { "mode": "fixed", "value": 0 },
    "EXIF:ExposureMode": { "mode": "fixed", "value": 0 },
    "EXIF:ColorSpace": { "mode": "fixed", "value": 1 },
    "EXIF:FNumber": {
      "mode": "pool",
      "pool": [
        { "value": 1.68, "weight": 5 },
        { "value": 2.8, "weight": 2 },
        { "value": 2.2, "weight": 2 }
      ]
    },
    "EXIF:FocalLength": {
      "mode": "pool",
      "pool": [
        { "value": 6.9, "weight": 5 },
        { "value": 18.0, "weight": 2 },
        { "value": 2.0, "weight": 2 }
      ]
    },
    "EXIF:FocalLengthIn35mmFilm": {
      "mode": "pool",
      "pool": [
        { "value": 25, "weight": 5 },
        { "value": 113, "weight": 2 },
        { "value": 12, "weight": 2 }
      ]
    },
    "EXIF:ExposureTime": {
      "mode": "pool",
      "pool": [
        { "value": "1/100", "weight": 3 },
        { "value": "1/200", "weight": 3 },
        { "value": "1/400", "weight": 2 },
        { "value": "1/50", "weight": 2 }
      ]
    },
    "EXIF:ISOSpeedRatings": {
      "mode": "pool",
      "pool": [
        { "value": 30, "weight": 4 },
        { "value": 60, "weight": 3 },
        { "value": 120, "weight": 2 },
        { "value": 400, "weight": 1 }
      ]
    },
    "XMP:xmp:CreatorTool": { "mode": "fixed", "value": "HDR+ 1.0.646262773zd" },
    "XMP:tiff:Make": { "mode": "fixed", "value": "Google" },
    "XMP:tiff:Model": { "mode": "fixed", "value": "Pixel 9 Pro" }
  },
  "constraints": [
    { "type": "requires", "fields": ["EXIF:Make", "EXIF:Model"] },
    { "type": "clamp", "fields": ["EXIF:FNumber", "EXIF:FocalLength", "EXIF:ISOSpeedRatings"] }
  ]
}
